training/weights/resnet34/evaluation_test/metrics.json

{
    "model": "ResNet-34",
    "checkpoint": "C:\\work\\code\\python\\NCKH_Phan_loai_vong_bi\\weights\\resnet34\\best_resnet34.pth",
    "checkpoint_epoch": 17,
    "test_samples": 235,
    "accuracy": 0.9744680851063829,
    "macro_precision": 0.9749907148162962,
    "macro_recall": 0.9692105348268092,
    "macro_f1": 0.9717792816591733,
    "weighted_precision": 0.9744979314251951,
    "weighted_recall": 0.9744680851063829,
    "weighted_f1": 0.9742113160923287,
    "classes": [
        "damaged_shield",
        "normal",
        "rusted",
        "surface_damage"
    ],
    "classification_report": {
        "damaged_shield": {
            "precision": 0.9772727272727273,
            "recall": 1.0,
            "f1-score": 0.9885057471264368,
            "support": 43.0
        },
        "normal": {
            "precision": 0.9767441860465116,
            "recall": 0.9130434782608695,
            "f1-score": 0.9438202247191011,
            "support": 46.0
        },
        "rusted": {
            "precision": 0.972972972972973,
            "recall": 0.9908256880733946,
            "f1-score": 0.9818181818181818,
            "support": 109.0
        },
        "surface_damage": {
            "precision": 0.972972972972973,
            "recall": 0.972972972972973,
            "f1-score": 0.972972972972973,
            "support": 37.0
        },
        "accuracy": 0.9744680851063829,
        "macro avg": {
            "precision": 0.9749907148162962,
            "recall": 0.9692105348268092,
            "f1-score": 0.9717792816591733,
            "support": 235.0
        },
        "weighted avg": {
            "precision": 0.9744979314251951,
            "recall": 0.9744680851063829,
            "f1-score": 0.9742113160923287,
            "support": 235.0
        }
    },
    "confusion_matrix": [
        [
            43,
            0,
            0,
            0
        ],
        [
            0,
            42,
            3,
            1
        ],
        [
            0,
            1,
            108,
            0
        ],
        [
            1,
            0,
            0,
            36
        ]
    ]
}

README.md

#### Chi tiết độ chính xác phân loại 4 lớp (Tập Test độc lập 235 mẫu):

- `normal` (Đạt chuẩn $\rightarrow$ **OK**): Precision **97.7%**, Recall **91.3%**, F1 **94.4%**.
- `damaged_shield` (Hư nắp chắn bụi $\rightarrow$ **NG**): Precision **97.7%**, Recall **100.0%**, F1 **98.8%**.
- `rusted` (Gỉ sét oxy hóa $\rightarrow$ **NG**): Precision **97.3%**, Recall **99.1%**, F1 **98.2%**.
- `surface_damage` (Trầy xước/khuyết tật mặt lăn $\rightarrow$ **NG**): Precision **97.3%**, Recall **97.3%**, F1 **97.3%**.